[{"content_digest":"sha256:3b244e3a3aa32308ddcc116bcd32b718aac969e12b6c231dd6a2d3b5c910a6fa","content_kind":"workspace_content","derived_from":[],"input_id":"in-i29","origin":"file:README.md","parent_id":null,"source":{"id":"mock-workspace","kind":"runtime"},"trace_id":"trace-i29","trust":"workspace_untrusted"},{"content_digest":"sha256:37f617ccf4768600d8d78da8a66f5a264098dbac34dbf456342181ab4a3776ad","content_kind":"unknown","derived_from":[],"input_id":"in-auto-0","origin":"runtime:mock","parent_id":"call_i29a","source":{"id":"mock","kind":"runtime"},"trace_id":"trace-i29","trust":"unknown"},{"content_digest":"sha256:633c6dbd78856408a0cddcf807012c86b2f97bf2918219e8dd6cf4bc5f082665","content_kind":"unknown","derived_from":[],"input_id":"in-auto-1","origin":"runtime:mock","parent_id":"call_i29b","source":{"id":"mock","kind":"runtime"},"trace_id":"trace-i29","trust":"unknown"}]
