[{"content_digest":"sha256:7c3233acab1cc0c067c05081dad9c22e13fc520eeda42bd2e97a64a5bcf16886","content_kind":"document","derived_from":[],"input_id":"in-auto-0","origin":"runtime:mock","parent_id":"call_i19a","source":{"id":"mock","kind":"runtime"},"trace_id":"trace-i19","trust":"external_untrusted"},{"content_digest":"sha256:d375aeb90b45745248a244d05adcb41b83a83b1aa716954992cc2d3f82884dab","content_kind":"unknown","derived_from":[],"input_id":"in-auto-1","origin":"runtime:mock","parent_id":"call_i19b","source":{"id":"mock","kind":"runtime"},"trace_id":"trace-i19","trust":"unknown"}]
