[{"content_digest":"sha256:de4d1eeaca31f6d6d398b5261137852ee7f0e39a7ebae73ce8f70bcfd7550df1","content_kind":"document","derived_from":[],"input_id":"in-i35","origin":"file:notes/guide.md","parent_id":null,"source":{"id":"mock-docs","kind":"runtime"},"trace_id":"trace-i35","trust":"external_untrusted"},{"content_digest":"sha256:bca6af00187fc370abb1c6bc8600c755df5ac264d06a13c1850d6d47a58a2721","content_kind":"unknown","derived_from":[],"input_id":"in-auto-0","origin":"runtime:mock","parent_id":"call_i35a","source":{"id":"mock","kind":"runtime"},"trace_id":"trace-i35","trust":"unknown"},{"content_digest":"sha256:2ac486a1e60c7b4926b3799c1f8d95cfd790da4c937067f9d480cd884ac4ae3f","content_kind":"unknown","derived_from":[],"input_id":"in-auto-1","origin":"runtime:mock","parent_id":"call_i35b","source":{"id":"mock","kind":"runtime"},"trace_id":"trace-i35","trust":"unknown"}]
