[{"content_digest":"sha256:aaaaaaaaaaaaaaaaaaaaaaaaaaaaaaaaaaaaaaaaaaaaaaaaaaaaaaaaaaaaaaaa","content_kind":"user_request","derived_from":[],"input_id":"in-i43-user","origin":"runtime:user-turn-1","parent_id":null,"source":{"id":"drake","kind":"operator"},"trace_id":"trace-i43","trust":"user_supplied"},{"content_digest":"sha256:bc1f4f60419936de0e8f9daea6f7c9f3b8cd27ae63f663f510fd365ba1fe363c","content_kind":"web_content","derived_from":[],"input_id":"in-auto-0","origin":"runtime:mock","parent_id":"call_i43a","source":{"id":"mock","kind":"runtime"},"trace_id":"trace-i43","trust":"external_untrusted"},{"content_digest":"sha256:d90c4589b73f8de99c57c93733ea6508ab7dfa1d4004ec12d358c8028962c152","content_kind":"unknown","derived_from":[],"input_id":"in-auto-1","origin":"runtime:mock","parent_id":"call_i43b","source":{"id":"mock","kind":"runtime"},"trace_id":"trace-i43","trust":"unknown"}]
